[
  {
    "id": "starter_allowance",
    "version": 1,
    "name": "零花钱",
    "cost": 0,
    "rarity": "common",
    "lane": "daily",
    "type": "action",
    "starter": true,
    "tags": [],
    "text": {
      "body": "获得 2 资源。"
    },
    "abilities": [
      {
        "trigger": "onPlay",
        "effects": [{ "op": "gainResource", "amount": 2 }]
      }
    ]
  },
  {
    "id": "starter_quarrel",
    "version": 1,
    "name": "争执",
    "cost": 0,
    "rarity": "common",
    "lane": "activity",
    "type": "action",
    "starter": true,
    "tags": [],
    "text": {
      "body": "获得 1 攻击。"
    },
    "abilities": [
      {
        "trigger": "onPlay",
        "effects": [{ "op": "gainAttack", "amount": 1 }]
      }
    ]
  },
  {
    "id": "starter_draft_paper",
    "version": 1,
    "name": "草稿纸",
    "cost": 0,
    "rarity": "common",
    "lane": "course",
    "type": "action",
    "starter": true,
    "tags": [],
    "text": {
      "body": "摸 1 张牌。"
    },
    "abilities": [
      {
        "trigger": "onPlay",
        "effects": [{ "op": "draw", "count": 1 }]
      }
    ]
  },
  {
    "id": "starter_punctuality",
    "version": 1,
    "name": "守时",
    "cost": 0,
    "rarity": "common",
    "lane": "daily",
    "type": "action",
    "starter": true,
    "tags": [],
    "text": {
      "body": "获得 1 资源和 1 防备。"
    },
    "abilities": [
      {
        "trigger": "onPlay",
        "effects": [
          { "op": "gainResource", "amount": 1 },
          { "op": "gainBlock", "amount": 1 }
        ]
      }
    ]
  }
]
